[
  {
    "metric_run_id": "run-42-click:daily_click_count",
    "metric_name": "daily_click_count",
    "metric_definition_version": "0.3.1",
    "input_snapshot_id": "62acdc8d9ac49a3e85f738b415556f202ecc3fc9fa6a007ca0421d7e692b7528",
    "input_received_at_watermark": "2026-08-21T00:00:00.000Z",
    "input_ledger_position": "2026-08-20T15:00:01.000Z|install-42",
    "computed_at": "2026-08-21T00:01:00.000Z",
    "data_freshness": "complete",
    "aggregation_time_zone": "UTC",
    "rule_bundle_id": "metric-stage-m3",
    "rule_bundle_version": "0.3.1",
    "rule_bundle_hash": "3333333333333333333333333333333333333333333333333333333333333333",
    "rounding_mode": "half_even",
    "reproducibility_status": "fully_reproducible",
    "value_type": "count",
    "value_unscaled": "1",
    "grouping": {
      "dimensions": { "metric_date": "2026-08-20" },
      "dimension_digest": "fa01365cf546acb09901470599f02c86230f7b03d1275d37dbcbbe2f54916ff9"
    },
    "evidence_refs": [
      {
        "tenant_id": "tenant-a",
        "app_id": "app-a",
        "ref": "click-42",
        "lifecycle_status": "available",
        "access_class": "protected"
      },
      {
        "tenant_id": "tenant-a",
        "app_id": "app-a",
        "ref": "install-42",
        "lifecycle_status": "available",
        "access_class": "protected"
      }
    ]
  },
  {
    "metric_run_id": "run-42-install:daily_install_count",
    "metric_name": "daily_install_count",
    "metric_definition_version": "0.3.1",
    "input_snapshot_id": "62acdc8d9ac49a3e85f738b415556f202ecc3fc9fa6a007ca0421d7e692b7528",
    "input_received_at_watermark": "2026-08-21T00:00:00.000Z",
    "input_ledger_position": "2026-08-20T15:00:01.000Z|install-42",
    "computed_at": "2026-08-21T00:01:00.000Z",
    "data_freshness": "complete",
    "aggregation_time_zone": "UTC",
    "rule_bundle_id": "metric-stage-m3",
    "rule_bundle_version": "0.3.1",
    "rule_bundle_hash": "3333333333333333333333333333333333333333333333333333333333333333",
    "rounding_mode": "half_even",
    "reproducibility_status": "fully_reproducible",
    "value_type": "count",
    "value_unscaled": "1",
    "grouping": {
      "dimensions": { "metric_date": "2026-08-20", "attribution_status": "organic" },
      "dimension_digest": "fc4d4986dccd4f2e0170fe3560b735b1e39c3244f2f9dfa942e19ac618f2d5ce"
    },
    "evidence_refs": [
      {
        "tenant_id": "tenant-a",
        "app_id": "app-a",
        "ref": "click-42",
        "lifecycle_status": "available",
        "access_class": "protected"
      },
      {
        "tenant_id": "tenant-a",
        "app_id": "app-a",
        "ref": "install-42",
        "lifecycle_status": "available",
        "access_class": "protected"
      }
    ]
  }
]
