[
  {
    "metric_run_id": "run-09:d0_install_to_24h_ad_revenue_usd",
    "metric_name": "d0_install_to_24h_ad_revenue_usd",
    "metric_definition_version": "0.3.0",
    "input_snapshot_id": "212dd4ab794e1bcb7ac62dfdc5e9f99e97eccd81b73d2908469c388e5071ce65",
    "input_received_at_watermark": "2026-08-12T00:00:00.000Z",
    "input_ledger_position": "2026-08-12T00:00:00.000Z|revenue-9",
    "computed_at": "2026-08-12T00:00:00.000Z",
    "data_freshness": "complete",
    "aggregation_time_zone": "UTC",
    "rule_bundle_id": "metric-default",
    "rule_bundle_version": "0.3.0",
    "rule_bundle_hash": "f765891ef3ac0337da9811cfb00f3883e3eece5a0ef3ec4ac23a6b2d0a24e443",
    "rounding_mode": "half_even",
    "reproducibility_status": "fully_reproducible",
    "value_type": "money",
    "value_unscaled": "1000000",
    "fx_rate_unscaled": "100000000",
    "fx_rate_scale": 8,
    "fx_rate_source": "synthetic-fixture-rate",
    "fx_rate_as_of": "2026-08-12T00:00:00.000Z",
    "fx_rate_snapshot_id": "ffa58914aa0e3f8339ca16e6b7a79dd194b20f6b3df574e3e22997d6612f4a05",
    "fx_policy_version": "fx-v0.1",
    "amount_scale": 6,
    "currency": "USD",
    "evidence_refs": [
      {
        "tenant_id": "tenant-a",
        "app_id": "app-a",
        "ref": "install-9",
        "lifecycle_status": "available",
        "access_class": "protected"
      },
      {
        "tenant_id": "tenant-a",
        "app_id": "app-a",
        "ref": "revenue-9",
        "lifecycle_status": "available",
        "access_class": "protected"
      }
    ]
  },
  {
    "metric_run_id": "run-09:d0_jst_install_calendar_ad_revenue_usd",
    "metric_name": "d0_jst_install_calendar_ad_revenue_usd",
    "metric_definition_version": "0.3.0",
    "input_snapshot_id": "212dd4ab794e1bcb7ac62dfdc5e9f99e97eccd81b73d2908469c388e5071ce65",
    "input_received_at_watermark": "2026-08-12T00:00:00.000Z",
    "input_ledger_position": "2026-08-12T00:00:00.000Z|revenue-9",
    "computed_at": "2026-08-12T00:00:00.000Z",
    "data_freshness": "complete",
    "aggregation_time_zone": "Asia/Tokyo",
    "rule_bundle_id": "metric-default",
    "rule_bundle_version": "0.3.0",
    "rule_bundle_hash": "f765891ef3ac0337da9811cfb00f3883e3eece5a0ef3ec4ac23a6b2d0a24e443",
    "rounding_mode": "half_even",
    "reproducibility_status": "fully_reproducible",
    "value_type": "money",
    "value_unscaled": "1000000",
    "fx_rate_unscaled": "100000000",
    "fx_rate_scale": 8,
    "fx_rate_source": "synthetic-fixture-rate",
    "fx_rate_as_of": "2026-08-12T00:00:00.000Z",
    "fx_rate_snapshot_id": "ffa58914aa0e3f8339ca16e6b7a79dd194b20f6b3df574e3e22997d6612f4a05",
    "fx_policy_version": "fx-v0.1",
    "amount_scale": 6,
    "currency": "USD",
    "evidence_refs": [
      {
        "tenant_id": "tenant-a",
        "app_id": "app-a",
        "ref": "install-9",
        "lifecycle_status": "available",
        "access_class": "protected"
      },
      {
        "tenant_id": "tenant-a",
        "app_id": "app-a",
        "ref": "revenue-9",
        "lifecycle_status": "available",
        "access_class": "protected"
      }
    ]
  },
  {
    "metric_run_id": "run-09:d0_utc_install_calendar_ad_revenue_usd",
    "metric_name": "d0_utc_install_calendar_ad_revenue_usd",
    "metric_definition_version": "0.3.0",
    "input_snapshot_id": "212dd4ab794e1bcb7ac62dfdc5e9f99e97eccd81b73d2908469c388e5071ce65",
    "input_received_at_watermark": "2026-08-12T00:00:00.000Z",
    "input_ledger_position": "2026-08-12T00:00:00.000Z|revenue-9",
    "computed_at": "2026-08-12T00:00:00.000Z",
    "data_freshness": "complete",
    "aggregation_time_zone": "UTC",
    "rule_bundle_id": "metric-default",
    "rule_bundle_version": "0.3.0",
    "rule_bundle_hash": "f765891ef3ac0337da9811cfb00f3883e3eece5a0ef3ec4ac23a6b2d0a24e443",
    "rounding_mode": "half_even",
    "reproducibility_status": "fully_reproducible",
    "value_type": "money",
    "value_unscaled": "0",
    "fx_rate_unscaled": "100000000",
    "fx_rate_scale": 8,
    "fx_rate_source": "synthetic-fixture-rate",
    "fx_rate_as_of": "2026-08-12T00:00:00.000Z",
    "fx_rate_snapshot_id": "ffa58914aa0e3f8339ca16e6b7a79dd194b20f6b3df574e3e22997d6612f4a05",
    "fx_policy_version": "fx-v0.1",
    "amount_scale": 6,
    "currency": "USD",
    "evidence_refs": [
      {
        "tenant_id": "tenant-a",
        "app_id": "app-a",
        "ref": "install-9",
        "lifecycle_status": "available",
        "access_class": "protected"
      },
      {
        "tenant_id": "tenant-a",
        "app_id": "app-a",
        "ref": "revenue-9",
        "lifecycle_status": "available",
        "access_class": "protected"
      }
    ]
  }
]
