[
  {
    "metric_run_id": "run-37:d1_roas",
    "metric_name": "d1_roas",
    "metric_definition_version": "0.2.0",
    "input_snapshot_id": "a45ca9aedbe115d2e9e9488eaf7d0bfe17ed072e4c63952a6361de60645873a9",
    "input_received_at_watermark": "2026-08-19T01:00:00.000Z",
    "input_ledger_position": "2026-08-19T00:00:01.000Z|install-37",
    "computed_at": "2026-08-19T01:01:00.000Z",
    "data_freshness": "complete",
    "aggregation_time_zone": "UTC",
    "rule_bundle_id": "metric-stage-b",
    "rule_bundle_version": "0.2.0",
    "rule_bundle_hash": "2222222222222222222222222222222222222222222222222222222222222222",
    "rounding_mode": "half_even",
    "reproducibility_status": "fully_reproducible",
    "value_type": "ratio",
    "value_state": "undefined",
    "undefined_reason": "no_attributed_cost",
    "ratio_scale": 6,
    "evidence_refs": [
      {
        "tenant_id": "tenant-a",
        "app_id": "app-a",
        "ref": "install-37",
        "lifecycle_status": "available",
        "access_class": "protected"
      }
    ]
  }
]
